[
  {
    "id": "SEOUL_YOUTH_001",
    "name": "서울시 청년수당",
    "agency": "서울특별사업",
    "category": "Custom",
    "amount_text": "최대 300만원",
    "amount_max": 3000000,
    "description": "미취업 청년의 자립과 구직 활동을 지원하는 수당입니다.",
    "eligibility": {
      "age": [
        19,
        34
      ],
      "residence": [
        "서울"
      ]
    },
    "apply_period": "2024.03 ~ 2024.12",
    "source_url": "https://youth.seoul.go.kr/front/youthPolicy/youthPolicyDetail.do?srchTab=all&biz_id=1"
  },
  {
    "id": "SEOUL_LIFE_001",
    "name": "서울형 유급병가 지원",
    "agency": "서울시 보건복지부",
    "category": "Local",
    "amount_text": "최대 89,190원/일",
    "amount_max": 89190,
    "description": "아파도 쉴 수 없는 자영업자 및 프리랜서에게 병가 비용을 지원합니다.",
    "eligibility": {
      "age": [
        0,
        100
      ],
      "residence": [
        "서울"
      ]
    },
    "apply_period": "상시",
    "source_url": "https://ssd.eseoul.go.kr/"
  },
  {
    "id": "SEOUL_YOUTH_002",
    "name": "서울 청년 대중교통비 지원",
    "agency": "서울특별사업",
    "category": "Custom",
    "amount_text": "연간 최대 10만원",
    "amount_max": 100000,
    "description": "청년들의 경제적 부담을 덜어주기 위해 대중교통 이용 금액의 20%를 마일리지로 환급해줍니다.",
    "eligibility": {
      "age": [
        19,
        24
      ],
      "residence": [
        "서울"
      ]
    },
    "apply_period": "2024.03 ~ 2024.04",
    "source_url": "https://youth.seoul.go.kr/"
  },
  {
    "id": "SEOUL_LIFE_002",
    "name": "서울시 임산부 교통비 지원",
    "agency": "서울특별사업",
    "category": "Local",
    "amount_text": "70만원",
    "amount_max": 700000,
    "description": "임산부의 이동 편의를 위해 70만원의 교통 포인트(카드)를 지원합니다.",
    "eligibility": {
      "age": [
        0,
        100
      ],
      "residence": [
        "서울"
      ],
      "target": "임산부"
    },
    "apply_period": "임신 12주 ~ 출산 후 3개월",
    "source_url": "https://momon.seoul.go.kr/"
  },
  {
    "id": "MAPO_YOUTH_001",
    "name": "마포 청년도전지원사업",
    "agency": "마포구 고용복지지원센터",
    "category": "Custom",
    "amount_text": "최대 350만원",
    "amount_max": 3500000,
    "description": "미취업 청년의 구직 의욕 고취와 사회 진입을 위한 참여 수당 및 인센티브를 지원합니다.",
    "eligibility": {
      "age": [
        18,
        34
      ],
      "residence": [
        "서울"
      ],
      "sub_residence": [
        "마포구"
      ],
      "target": "미취업 청년"
    },
    "apply_period": "2024.02 ~ 모집 시까지",
    "source_url": "https://www.mapo.go.kr/"
  },
  {
    "id": "MAPO_BIZ_001",
    "name": "마포구 소상공인 저금리 융자",
    "agency": "마포구청 경제진흥과",
    "category": "Agency",
    "amount_text": "최대 3,000만원 융자",
    "amount_max": 30000000,
    "description": "자금난을 겪는 소상공인 및 중소기업을 위해 저금리 융자와 이자 차액을 지원합니다.",
    "eligibility": {
      "age": [
        0,
        100
      ],
      "residence": [
        "서울"
      ],
      "sub_residence": [
        "마포구"
      ],
      "target": "소상공인"
    },
    "apply_period": "한도 소진 시까지",
    "source_url": "https://www.mapo.go.kr/"
  }
]