[
  {
    "id": "BOKJIRO_001",
    "name": "긴급복지 생계지원",
    "agency": "보건복지부",
    "category": "Agency",
    "amount_text": "4인 가구 기준 월 183만원",
    "amount_max": 1833500,
    "description": "갑작스러운 위기사유 발생으로 생계유지가 곤란한 저소득 가구에게 생계비를 신속하게 지원합니다.",
    "eligibility": {
      "age": [
        0,
        100
      ],
      "income": "중위소득 75% 이하",
      "target": "위기가구"
    },
    "apply_period": "상시 신청",
    "source_url": "https://www.bokjiro.go.kr/ssis-tbu/twjaa/wlfareInfo/moveTWJAA00005.do?wlfareInfoId=WLF00000060"
  },
  {
    "id": "BOKJIRO_002",
    "name": "청년내일저축계좌",
    "agency": "보건복지부",
    "category": "Custom",
    "amount_text": "3년 만기 시 최대 1,440만원+이자가",
    "amount_max": 14400000,
    "description": "일하는 저소득 청년이 3년간 매월 10만원을 저축하면 정부가 월 10~30만원을 지원합니다.",
    "eligibility": {
      "age": [
        19,
        34
      ],
      "income": "중위소득 100% 이하",
      "target": "일하는 청년"
    },
    "apply_period": "매년 5월경 모집",
    "source_url": "https://www.bokjiro.go.kr/ssis-tbu/twjaa/wlfareInfo/moveTWJAA00005.do?wlfareInfoId=WLF00004663"
  }
]