[
  {
    "id": "CHUNGBUK_YOUTH_001",
    "name": "충북 청년 복지포인트 (근로자)",
    "agency": "충청북도",
    "category": "Custom",
    "amount_text": "연간 120만원",
    "amount_max": 1200000,
    "description": "충북 내 중소기업 재직 청년에게 복지포인트를 지원하여 복리후생을 강화합니다.",
    "eligibility": {
      "age": [
        18,
        39
      ],
      "residence": [
        "충북"
      ],
      "target": "중소기업 재직자"
    },
    "apply_period": "매년 공고 (주로 4월)",
    "source_url": "https://www.chungbuk.go.kr/"
  },
  {
    "id": "CHUNGNAM_YOUTH_001",
    "name": "충남 청년 희망카드",
    "agency": "충청남도",
    "category": "Custom",
    "amount_text": "최대 50만원 (포인트)",
    "amount_max": 500000,
    "description": "충남 청년들의 구직 활동 및 자기계발 비용을 지원하는 카드입니다.",
    "eligibility": {
      "age": [
        19,
        39
      ],
      "residence": [
        "충남"
      ],
      "target": "미취업 청년"
    },
    "apply_period": "예산 소진 시까지",
    "source_url": "https://www.chungnam.go.kr/"
  },
  {
    "id": "CHUNGNAM_LIFE_001",
    "name": "충남 농어민수당",
    "agency": "충청남도",
    "category": "Local",
    "amount_text": "연 80만원 (지역화폐)",
    "amount_max": 800000,
    "description": "농어업의 공익적 기능 증진을 위해 농어민에게 수당을 지급합니다.",
    "eligibility": {
      "age": [
        0,
        100
      ],
      "residence": [
        "충남"
      ],
      "target": "농어민"
    },
    "apply_period": "매년 2월 ~ 4월",
    "source_url": "https://www.chungnam.go.kr/"
  }
]