[
  {
    "id": "GYEONGNAM_YOUTH_001",
    "name": "경남 청년 정보 드림패스",
    "agency": "경상남도",
    "category": "Custom",
    "amount_text": "연간 최대 10만원 (교통/문화)",
    "amount_max": 100000,
    "description": "경남 청년들에게 교통비 및 문화 교육비를 바우처 형식으로 지원합니다.",
    "eligibility": {
      "age": [
        19,
        34
      ],
      "residence": [
        "경남"
      ]
    },
    "apply_period": "2024.03 ~ 2024.12",
    "source_url": "https://www.gyeongnam.go.kr/youth/"
  },
  {
    "id": "GYEONGBUK_YOUTH_001",
    "name": "경북 청년 복지카드 (근로자)",
    "agency": "경상북도",
    "category": "Custom",
    "amount_text": "연간 100만원",
    "amount_max": 1000000,
    "description": "경북 내 중소기업 등에 재직 중인 청년에게 복지포인트를 지원합니다.",
    "eligibility": {
      "age": [
        19,
        39
      ],
      "residence": [
        "경북"
      ],
      "target": "중소기업 재직자"
    },
    "apply_period": "매년 공고 (분기별 모집)",
    "source_url": "https://www.gb.go.kr/"
  },
  {
    "id": "GYEONGNAM_LIFE_001",
    "name": "경남 어르신 문화/체육 복지비 지원",
    "agency": "경상남도",
    "category": "Local",
    "amount_text": "연 10만원 (바우처)",
    "amount_max": 100000,
    "description": "경남 지역 어르신들의 여가 활동을 위해 문화/체육 바우처를 제공합니다.",
    "eligibility": {
      "age": [
        65,
        100
      ],
      "residence": [
        "경남"
      ]
    },
    "apply_period": "상시 접수",
    "source_url": "https://www.gyeongnam.go.kr/"
  }
]