[
  {
    "id": "GANGWON_YOUTH_001",
    "name": "강원 청년 디딤돌 2배 적금",
    "agency": "강원특별자치도",
    "category": "Custom",
    "amount_text": "최대 1,080만원 (정부/도 매칭)",
    "amount_max": 10800000,
    "description": "강원도 내 일하는 청년이 저축하면 도에서 매칭 지원금을 지원하여 자산 형성을 돕습니다.",
    "eligibility": {
      "age": [
        18,
        39
      ],
      "residence": [
        "강원"
      ],
      "income": "중위소득 140% 이하"
    },
    "apply_period": "매년 공고 (하반기)",
    "source_url": "https://www.gwd.go.kr/"
  },
  {
    "id": "GANGWON_YOUTH_002",
    "name": "강원 특별자치도 청년 스테-이 (GANGWON STA-E)",
    "agency": "강원특별자치도",
    "category": "Custom",
    "amount_text": "연간 최대 240만원 (월 20만원 지원)",
    "amount_max": 2400000,
    "description": "지역 내 중소기업 등에 취업한 청년들의 근속 유도를 위해 주거비 등을 지원합니다.",
    "eligibility": {
      "age": [
        18,
        39
      ],
      "residence": [
        "강원"
      ],
      "target": "중소기업 재직자"
    },
    "apply_period": "2024.03 ~ 예산 소진 시",
    "source_url": "https://www.gwd.go.kr/"
  },
  {
    "id": "GANGWON_LIFE_001",
    "name": "강원 농업인 수당",
    "agency": "강원특별자치도",
    "category": "Local",
    "amount_text": "연 70만원 (지역화폐)",
    "amount_max": 700000,
    "description": "강원 지역 농어업인의 경영 안정과 소득 지탱을 위해 수당을 지급합니다.",
    "eligibility": {
      "age": [
        0,
        100
      ],
      "residence": [
        "강원"
      ],
      "target": "농어민"
    },
    "apply_period": "매년 3월 ~ 5월",
    "source_url": "https://www.gwd.go.kr/"
  }
]